{
  "bundle_version": "memoryoss.passport.v1alpha1",
  "passport_id": "11111111-1111-7111-8111-111111111111",
  "runtime_contract": {
    "contract_id": "memoryoss.runtime.v1alpha1",
    "version": "2026-03-13",
    "document_route": "/v1/runtime/contract",
    "stable_semantics": [
      "namespace_scope",
      "provenance",
      "portable_export"
    ],
    "experimental_layers_excluded": [
      "retrieval_confidence_gate",
      "identifier_first_routing",
      "summary_evidence_recall"
    ]
  },
  "scope": "project",
  "namespace": "demo",
  "exported_at": "2026-03-13T00:00:00Z",
  "provenance": {
    "exported_from_namespace": "demo",
    "source_key_ids": [
      "key_demo_1234"
    ]
  },
  "integrity": {
    "algorithm": "sha256",
    "payload_sha256": "f854ea8fd52cc88eb0da55d7cc56c1f7dadcc88fba286b7a5e9e2a6caa29abc8",
    "signed": false
  },
  "memories": [
    {
      "id": "22222222-2222-7222-8222-222222222222",
      "content": "Deploy API through /v1/proxy only after staging signoff.",
      "tags": [
        "project",
        "deploy"
      ],
      "agent": "release-bot",
      "session": "deploy-session",
      "original_namespace": "demo",
      "memory_type": "procedural",
      "status": "stale",
      "version": 2,
      "created_at": "2026-03-10T09:00:00Z",
      "updated_at": "2026-03-12T18:00:00Z",
      "source_key_id": "key_demo_1234",
      "content_hash": "0a4595f791ad63f6db1b58782798abe0a9acd5dde68493d0daeb695843a0b235",
      "archived": false,
      "confidence": 0.94,
      "evidence_count": 2,
      "last_verified_at": "2026-03-12T18:00:00Z",
      "superseded_by": "33333333-3333-7333-8333-333333333333",
      "review_events": [
        {
          "at": "2026-03-12T18:00:00Z",
          "actor": "operator",
          "action": "supersede",
          "via": "review_queue",
          "queue_kind": "contested",
          "superseded_by": "33333333-3333-7333-8333-333333333333"
        }
      ]
    },
    {
      "id": "33333333-3333-7333-8333-333333333333",
      "content": "Review queue items stay candidate until an operator confirms them.",
      "tags": [
        "project",
        "review"
      ],
      "agent": "review-bot",
      "session": "review-session",
      "original_namespace": "demo",
      "memory_type": "semantic",
      "status": "active",
      "version": 3,
      "created_at": "2026-03-11T10:00:00Z",
      "updated_at": "2026-03-13T08:30:00Z",
      "source_key_id": "key_demo_1234",
      "content_hash": "2fb427ac5aafdf60e9fb5e23bb0f4ed8cc4c4ea559dd989e74453af2c104541e",
      "archived": false,
      "confidence": 0.99,
      "evidence_count": 1,
      "last_verified_at": "2026-03-13T08:30:00Z",
      "review_events": [
        {
          "at": "2026-03-13T08:30:00Z",
          "actor": "operator",
          "action": "confirm",
          "via": "review_queue",
          "queue_kind": "candidate"
        }
      ]
    }
  ]
}
